{
  "schemaVersion": 1,
  "taskId": "internal-foreach-maxitems-boundary-draft",
  "candidateId": "review-case-m13",
  "status": "locked",
  "sourceRevision": "a48c12a899447309b0adbb200d014c88cca61c8c",
  "fixturePatch": "fixture.diff",
  "referenceFixPatch": "reference-fix.patch",
  "bugs": [
    {
      "bugId": "G1",
      "severity": "medium",
      "category": "correctness",
      "summary": "The proposed patch blocks foreach expansion when item count equals maxItems.",
      "impact": "`maxItems` is intended as an inclusive upper bound. Using `>=` rejects valid workflows with exactly the configured maximum number of items.",
      "locations": [
        {
          "file": "src/engine.ts",
          "startLine": 568,
          "endLine": 571,
          "symbol": "extractArtifactGraphForeachItems"
        }
      ],
      "requiredEvidence": [
        {
          "file": "src/engine.ts",
          "quote": "items.length >= stage.maxItems",
          "matchMode": "substring"
        },
        {
          "file": "src/engine.ts",
          "quote": "exceeding maxItems=${stage.maxItems}",
          "matchMode": "substring"
        }
      ],
      "acceptableFixes": [
        "Restore the runtime guard to `items.length > stage.maxItems`.",
        "Restore the runtime guard and add an exact-boundary regression test where exactly `maxItems` items are allowed."
      ],
      "mustNotSay": [
        "`maxItems` is intended to be an exclusive upper bound.",
        "Exactly `maxItems` items should be rejected.",
        "Adding a boundary test alone fixes the runtime regression."
      ]
    }
  ],
  "noIssueRegions": [],
  "mustAvoidClaims": [
    "Using prior A/B run notes as evidence.",
    "Relying on git history instead of the sanitized workspace and proposed patch."
  ],
  "difficulty": {
    "bucket": "medium",
    "plainExpected": "mixed",
    "rationale": "Boundary-condition task; candidates must reason about inclusive maxItems semantics."
  },
  "leakagePolicy": {
    "candidateVisible": [
      "sanitized repo",
      "fixture.diff",
      "neutral review prompt"
    ],
    "candidateForbidden": [
      "gold-key.draft.json",
      "author-notes.md",
      "reference-fix.patch",
      "repro.sh",
      ".git",
      ".pi/eval",
      "A/B run artifacts"
    ]
  },
  "approval": {
    "state": "approved",
    "providerReviews": [
      ".pi/eval/bug-forge/provider-reviews/review-case-m13-gpt-review.md",
      ".pi/eval/bug-forge/provider-reviews/review-case-m13-kimi-review.md",
      ".pi/eval/bug-forge/provider-reviews/review-case-m13-final-kimi-review.md"
    ],
    "approvedBy": [
      "kimi-coding/kimi-for-coding:low final review",
      "repro.sh RED/GREEN"
    ],
    "notes": "Locked after revised gold evidence, explicit RED/GREEN repro, and final Kimi low approval. Earlier GPT/Kimi reviews confirmed bug existence but requested evidence revisions."
  }
}
