{
  "schemaVersion": 1,
  "taskId": "internal-output-trailing-prose-draft",
  "candidateId": "review-case-k11",
  "status": "draft",
  "sourceRevision": "a48c12a899447309b0adbb200d014c88cca61c8c",
  "fixturePatch": "fixture.diff",
  "referenceFixPatch": "reference-fix.patch",
  "bugs": [
    {
      "bugId": "G1",
      "severity": "medium",
      "category": "correctness",
      "summary": "The proposed patch stops rejecting prose after the final workflow output section.",
      "impact": "The workflow output protocol requires exactly ordered sections with no outside text; accepting trailing prose can let malformed model output pass validation and contaminate artifacts.",
      "locations": [
        {
          "file": "src/workflow-output-artifacts.ts",
          "startLine": 303,
          "endLine": 317,
          "symbol": "validateNoOutsideText"
        }
      ],
      "requiredEvidence": [
        {
          "file": "src/workflow-output-artifacts.ts",
          "quote": "if (false && raw.slice(cursor).trim().length > 0) issues.push(outsideTextIssue());",
          "matchMode": "substring"
        },
        {
          "file": "src/workflow-output-artifacts.ts",
          "quote": "Return exactly these sections, in this order, with no prose outside the tags",
          "matchMode": "substring"
        }
      ],
      "acceptableFixes": [
        "Restore the trailing outside-text check.",
        "Add a parser test with valid sections followed by extra prose."
      ],
      "mustNotSay": [
        "Trailing text is already inside refs/control; this check is specifically outside all sections."
      ]
    }
  ],
  "noIssueRegions": [],
  "mustAvoidClaims": [
    "Using prior A/B run notes as evidence.",
    "Relying on git history instead of the sanitized workspace and proposed patch."
  ],
  "difficulty": {
    "bucket": "medium",
    "plainExpected": "mixed",
    "rationale": "Protocol correctness task; bug is a one-line guard but impact requires protocol context."
  },
  "leakagePolicy": {
    "candidateVisible": [
      "sanitized repo",
      "fixture.diff",
      "neutral review prompt"
    ],
    "candidateForbidden": [
      "gold-key.draft.json",
      "author-notes.md",
      "reference-fix.patch",
      "repro.sh",
      ".git",
      ".pi/eval",
      "A/B run artifacts"
    ]
  },
  "approval": {
    "state": "needs-review",
    "providerReviews": [],
    "approvedBy": [],
    "notes": "Second-wave draft; validate/materialize only. Requires calibration and provider review before lock."
  }
}
