{
  "schemaVersion": 1,
  "taskId": "holdout-control-schema-path-containment",
  "candidateId": "review-case-x24",
  "status": "locked",
  "sourceRevision": "eacad6c512da81031d0fe033de368a5b4fce4057",
  "fixturePatch": "fixture.diff",
  "referenceFixPatch": "reference-fix.patch",
  "bugs": [
    {
      "bugId": "G1",
      "severity": "high",
      "category": "security",
      "summary": "The patch weakens workflow bundle path containment for controlSchema files.",
      "impact": "A relative ../ controlSchema path can pass validation and read schemas outside the workflow bundle, violating bundle isolation.",
      "locations": [
        {
          "file": "src/schema.ts",
          "startLine": 94,
          "endLine": 94,
          "symbol": "isInsidePath"
        }
      ],
      "requiredEvidence": [
        {
          "file": "src/schema.ts",
          "quote": "return rel === \"\" || (!rel.startsWith(\"..\") || !isAbsolute(rel));",
          "matchMode": "substring"
        }
      ],
      "acceptableFixes": [
        "Restore the AND condition so children must neither start with .. nor be absolute.",
        "Add a path traversal regression for output.controlSchema."
      ]
    }
  ],
  "noIssueRegions": [],
  "mustAvoidClaims": [
    "Using prior A/B run notes as evidence.",
    "Relying on git history instead of the sanitized workspace and proposed patch.",
    "Assuming every holdout task contains a seeded bug."
  ],
  "difficulty": {
    "bucket": "hard",
    "plainExpected": "mixed",
    "rationale": "A one-operator containment regression with security implications."
  },
  "leakagePolicy": {
    "candidateVisible": [
      "sanitized repo",
      "fixture.diff",
      "neutral review prompt"
    ],
    "candidateForbidden": [
      "gold-key.draft.json",
      "author-notes.md",
      "reference-fix.patch",
      "repro.sh",
      ".git",
      ".pi/eval",
      "A/B run artifacts"
    ]
  },
  "approval": {
    "state": "approved",
    "providerReviews": [],
    "approvedBy": [
      "local deterministic fixture authoring",
      "repro.sh RED/GREEN or no-op revert check"
    ],
    "notes": "Local blind holdout locked before calibration runs; provider review pending before promotion to primary release gate."
  }
}
