{
  "schemaVersion": 1,
  "taskId": "holdout-order-only-partial-source-inversion",
  "candidateId": "review-case-t20",
  "status": "locked",
  "sourceRevision": "eacad6c512da81031d0fe033de368a5b4fce4057",
  "fixturePatch": "fixture.diff",
  "referenceFixPatch": "reference-fix.patch",
  "bugs": [
    {
      "bugId": "G1",
      "severity": "medium",
      "category": "correctness",
      "summary": "The patch makes unrelated order-only failures block partial-source stages.",
      "impact": "A stage with partial source policy can be skipped because an after-only predecessor failed, even when its actual source stages are still usable.",
      "locations": [
        {
          "file": "src/workflow-runtime.ts",
          "startLine": 268,
          "endLine": 268,
          "symbol": "canStageProceedAfterPreviousFailure"
        }
      ],
      "requiredEvidence": [
        {
          "file": "src/workflow-runtime.ts",
          "quote": "if (!stage.sourceStageIds.includes(previous.id ?? \"\")) return false;",
          "matchMode": "substring"
        }
      ],
      "acceptableFixes": [
        "Return true when the failed previous stage is not one of the stage sourceStageIds.",
        "Add a regression for dependency-aware skip bypassing unrelated previous failures."
      ]
    }
  ],
  "noIssueRegions": [],
  "mustAvoidClaims": [
    "Using prior A/B run notes as evidence.",
    "Relying on git history instead of the sanitized workspace and proposed patch.",
    "Assuming every holdout task contains a seeded bug."
  ],
  "difficulty": {
    "bucket": "hard",
    "plainExpected": "mixed",
    "rationale": "The failure path depends on sourceStageIds rather than simple dependsOn."
  },
  "leakagePolicy": {
    "candidateVisible": [
      "sanitized repo",
      "fixture.diff",
      "neutral review prompt"
    ],
    "candidateForbidden": [
      "gold-key.draft.json",
      "author-notes.md",
      "reference-fix.patch",
      "repro.sh",
      ".git",
      ".pi/eval",
      "A/B run artifacts"
    ]
  },
  "approval": {
    "state": "approved",
    "providerReviews": [],
    "approvedBy": [
      "local deterministic fixture authoring",
      "repro.sh RED/GREEN or no-op revert check"
    ],
    "notes": "Local blind holdout locked before calibration runs; provider review pending before promotion to primary release gate."
  }
}
