{
  "schemaVersion": 1,
  "taskId": "oss-geth-tracer-stop-reason-data-race",
  "candidateId": "geth-case-006",
  "status": "locked",
  "sourceRevision": "22919cec1b257b3f2d3a2c348f432c08efae7114",
  "fixturePatch": "fixture.diff",
  "referenceFixPatch": "reference-fix.patch",
  "bugs": [
    {
      "bugId": "G1",
      "severity": "high",
      "category": "reliability",
      "summary": "The patch stores tracer interruption reasons in plain error fields that Stop writes concurrently with GetResult reads.",
      "impact": "Trace timeout/cancel paths can race RPC result collection across multiple native tracers, producing Go race detector failures and unsafe concurrent access to tracer state.",
      "locations": [
        {
          "file": "eth/tracers/native/call.go",
          "startLine": 118,
          "endLine": 278,
          "symbol": "callTracer.reason/Stop/GetResult"
        },
        {
          "file": "eth/tracers/logger/logger.go",
          "startLine": 231,
          "endLine": 380,
          "symbol": "StructLogger.reason/Stop/GetResult"
        },
        {
          "file": "eth/tracers/native/4byte.go",
          "startLine": 50,
          "endLine": 121,
          "symbol": "fourByteTracer.reason/Stop/GetResult"
        },
        {
          "file": "eth/tracers/native/prestate.go",
          "startLine": 229,
          "endLine": 248,
          "symbol": "prestateTracer.GetResult/Stop"
        }
      ],
      "requiredEvidence": [
        {
          "file": "eth/tracers/native/call.go",
          "quote": "reason    error",
          "matchMode": "substring"
        },
        {
          "file": "eth/tracers/logger/logger.go",
          "quote": "reason    error",
          "matchMode": "substring"
        },
        {
          "file": "eth/tracers/native/4byte.go",
          "quote": "reason            error",
          "matchMode": "substring"
        }
      ],
      "acceptableFixes": [
        "Store the interruption reason using atomic.Pointer[error] or equivalent synchronization and load it in GetResult.",
        "Do not read/write tracer reason fields unsynchronized across Stop and GetResult goroutines."
      ]
    }
  ],
  "noIssueRegions": [],
  "mustAvoidClaims": [
    "Using upstream PR titles, issue numbers, commit messages, or git history as evidence.",
    "Relying on private repro.sh, gold-key.draft.json, or reference-fix.patch.",
    "Claiming unrelated broad rewrites outside the proposed patch are required."
  ],
  "difficulty": {
    "bucket": "hard",
    "plainExpected": "mixed",
    "rationale": "The defect spans multiple tracer implementations and only appears under concurrent Stop/GetResult race testing."
  },
  "leakagePolicy": {
    "candidateVisible": [
      "sanitized go-ethereum workspace at pinned revision",
      "fixture.diff",
      "neutral review prompt"
    ],
    "candidateForbidden": [
      "gold-key.draft.json",
      "author-notes.md",
      "reference-fix.patch",
      "repro.sh",
      ".git",
      ".pi/eval",
      "judge prompts, answer keys, run artifacts, and A/B mappings",
      "upstream PR/issue text or commit message"
    ]
  },
  "approval": {
    "state": "approved",
    "providerReviews": [],
    "approvedBy": [
      "local deterministic OSS fixture authoring",
      "source-only reverse fixture with RED/GREEN repro"
    ],
    "notes": "Pilot OSS-derived holdout task; provider review pending before promotion to primary release gate."
  }
}
