{
  "schemaVersion": 1,
  "taskId": "holdout-partial-terminal-dependencies",
  "candidateId": "review-case-s19",
  "status": "locked",
  "sourceRevision": "eacad6c512da81031d0fe033de368a5b4fce4057",
  "fixturePatch": "fixture.diff",
  "referenceFixPatch": "reference-fix.patch",
  "bugs": [
    {
      "bugId": "G1",
      "severity": "high",
      "category": "reliability",
      "summary": "The patch blocks partial-source stages after failed or skipped terminal dependencies.",
      "impact": "Stages declaring sourcePolicy partial can deadlock or skip instead of synthesizing available successful sources and reporting partial failures.",
      "locations": [
        {
          "file": "src/engine.ts",
          "startLine": 1865,
          "endLine": 1865,
          "symbol": "dependenciesReady"
        }
      ],
      "requiredEvidence": [
        {
          "file": "src/engine.ts",
          "quote": "if (partial && status === \"completed\") return true;",
          "matchMode": "substring"
        }
      ],
      "acceptableFixes": [
        "Restore isTerminalTaskStatus(status) for partial dependencies.",
        "Add a scheduler regression where a partial join proceeds after one failed upstream task."
      ]
    }
  ],
  "noIssueRegions": [],
  "mustAvoidClaims": [
    "Using prior A/B run notes as evidence.",
    "Relying on git history instead of the sanitized workspace and proposed patch.",
    "Assuming every holdout task contains a seeded bug."
  ],
  "difficulty": {
    "bucket": "hard",
    "plainExpected": "mixed",
    "rationale": "Looks like stricter dependency gating but violates partial sourcePolicy semantics."
  },
  "leakagePolicy": {
    "candidateVisible": [
      "sanitized repo",
      "fixture.diff",
      "neutral review prompt"
    ],
    "candidateForbidden": [
      "gold-key.draft.json",
      "author-notes.md",
      "reference-fix.patch",
      "repro.sh",
      ".git",
      ".pi/eval",
      "A/B run artifacts"
    ]
  },
  "approval": {
    "state": "approved",
    "providerReviews": [],
    "approvedBy": [
      "local deterministic fixture authoring",
      "repro.sh RED/GREEN or no-op revert check"
    ],
    "notes": "Local blind holdout locked before calibration runs; provider review pending before promotion to primary release gate."
  }
}
