{
  "schemaVersion": 1,
  "taskId": "holdout-flat-workflow-alias-loss",
  "candidateId": "review-case-v22",
  "status": "locked",
  "sourceRevision": "eacad6c512da81031d0fe033de368a5b4fce4057",
  "fixturePatch": "fixture.diff",
  "referenceFixPatch": "reference-fix.patch",
  "bugs": [
    {
      "bugId": "G1",
      "severity": "medium",
      "category": "api_contract",
      "summary": "The patch removes extensionless aliases for flat workflow JSON files.",
      "impact": "Project workflows such as workflows/review.json no longer resolve via /workflow run review, breaking documented named workflow invocation.",
      "locations": [
        {
          "file": "src/workflow-specs.ts",
          "startLine": 240,
          "endLine": 240,
          "symbol": "aliasesFor"
        }
      ],
      "requiredEvidence": [
        {
          "file": "src/workflow-specs.ts",
          "quote": "return [name];",
          "matchMode": "substring"
        }
      ],
      "acceptableFixes": [
        "Restore the extensionless alias for flat .json workflow specs.",
        "Keep a registry test that resolveWorkflowRef(\"review\") finds workflows/review.json."
      ]
    }
  ],
  "noIssueRegions": [],
  "mustAvoidClaims": [
    "Using prior A/B run notes as evidence.",
    "Relying on git history instead of the sanitized workspace and proposed patch.",
    "Assuming every holdout task contains a seeded bug."
  ],
  "difficulty": {
    "bucket": "medium",
    "plainExpected": "mixed",
    "rationale": "Alias array change is easy to miss if reviewers focus on bundled workflows."
  },
  "leakagePolicy": {
    "candidateVisible": [
      "sanitized repo",
      "fixture.diff",
      "neutral review prompt"
    ],
    "candidateForbidden": [
      "gold-key.draft.json",
      "author-notes.md",
      "reference-fix.patch",
      "repro.sh",
      ".git",
      ".pi/eval",
      "A/B run artifacts"
    ]
  },
  "approval": {
    "state": "approved",
    "providerReviews": [],
    "approvedBy": [
      "local deterministic fixture authoring",
      "repro.sh RED/GREEN or no-op revert check"
    ],
    "notes": "Local blind holdout locked before calibration runs; provider review pending before promotion to primary release gate."
  }
}
